{
 "$schema": "https://json-schema.org/draft/2020-12/schema",
 "type": "object",
 "properties": {
  "version": {
   "type": "integer",
   "exclusiveMinimum": 0,
   "maximum": 9007199254740991
  },
  "status": {
   "type": "string",
   "enum": [
    "proposed",
    "active",
    "superseded",
    "rejected"
   ]
  },
  "reason": {
   "type": "string",
   "minLength": 1
  },
  "created_at": {
   "type": "string",
   "format": "date-time",
   "pattern": "^(?:(?:\\d\\d[2468][048]|\\d\\d[13579][26]|\\d\\d0[48]|[02468][048]00|[13579][26]00)-02-29|\\d{4}-(?:(?:0[13578]|1[02])-(?:0[1-9]|[12]\\d|3[01])|(?:0[469]|11)-(?:0[1-9]|[12]\\d|30)|(?:02)-(?:0[1-9]|1\\d|2[0-8])))T(?:(?:[01]\\d|2[0-3]):[0-5]\\d:[0-5]\\d(?:\\.\\d+)?(?:Z|([+-](?:[01]\\d|2[0-3]):[0-5]\\d)))$"
  },
  "effective_from": {
   "anyOf": [
    {
     "type": "string",
     "format": "date-time",
     "pattern": "^(?:(?:\\d\\d[2468][048]|\\d\\d[13579][26]|\\d\\d0[48]|[02468][048]00|[13579][26]00)-02-29|\\d{4}-(?:(?:0[13578]|1[02])-(?:0[1-9]|[12]\\d|3[01])|(?:0[469]|11)-(?:0[1-9]|[12]\\d|30)|(?:02)-(?:0[1-9]|1\\d|2[0-8])))T(?:(?:[01]\\d|2[0-3]):[0-5]\\d:[0-5]\\d(?:\\.\\d+)?(?:Z|([+-](?:[01]\\d|2[0-3]):[0-5]\\d)))$"
    },
    {
     "type": "null"
    }
   ]
  },
  "values": {
   "type": "array",
   "items": {
    "type": "object",
    "properties": {
     "key": {
      "type": "string",
      "enum": [
       "risk_per_trade_pct",
       "max_position_pct",
       "max_concurrent_positions",
       "target_concurrent_positions",
       "max_adv_share",
       "price_band_pct",
       "daily_loss_halt_pct",
       "kill_drawdown_pct",
       "min_edge_cost_ratio",
       "crisis_exposure_mult",
       "leak_ret5d_threshold",
       "max_sector_pct",
       "max_group_pct"
      ]
     },
     "value": {
      "type": "number"
     }
    },
    "required": [
     "key",
     "value"
    ],
    "additionalProperties": false
   }
  },
  "proposed_by": {
   "type": "object",
   "properties": {
    "uid": {
     "type": "string"
    },
    "name": {
     "type": "string"
    },
    "role": {
     "type": "string",
     "enum": [
      "analyst",
      "risk_officer",
      "admin",
      "auditor"
     ]
    },
    "at": {
     "type": "string",
     "format": "date-time",
     "pattern": "^(?:(?:\\d\\d[2468][048]|\\d\\d[13579][26]|\\d\\d0[48]|[02468][048]00|[13579][26]00)-02-29|\\d{4}-(?:(?:0[13578]|1[02])-(?:0[1-9]|[12]\\d|3[01])|(?:0[469]|11)-(?:0[1-9]|[12]\\d|30)|(?:02)-(?:0[1-9]|1\\d|2[0-8])))T(?:(?:[01]\\d|2[0-3]):[0-5]\\d:[0-5]\\d(?:\\.\\d+)?(?:Z|([+-](?:[01]\\d|2[0-3]):[0-5]\\d)))$"
    },
    "reason": {
     "type": [
      "string",
      "null"
     ]
    }
   },
   "required": [
    "uid",
    "name",
    "role",
    "at",
    "reason"
   ],
   "additionalProperties": false
  },
  "decided_by": {
   "anyOf": [
    {
     "type": "object",
     "properties": {
      "uid": {
       "type": "string"
      },
      "name": {
       "type": "string"
      },
      "role": {
       "type": "string",
       "enum": [
        "analyst",
        "risk_officer",
        "admin",
        "auditor"
       ]
      },
      "at": {
       "type": "string",
       "format": "date-time",
       "pattern": "^(?:(?:\\d\\d[2468][048]|\\d\\d[13579][26]|\\d\\d0[48]|[02468][048]00|[13579][26]00)-02-29|\\d{4}-(?:(?:0[13578]|1[02])-(?:0[1-9]|[12]\\d|3[01])|(?:0[469]|11)-(?:0[1-9]|[12]\\d|30)|(?:02)-(?:0[1-9]|1\\d|2[0-8])))T(?:(?:[01]\\d|2[0-3]):[0-5]\\d:[0-5]\\d(?:\\.\\d+)?(?:Z|([+-](?:[01]\\d|2[0-3]):[0-5]\\d)))$"
      },
      "reason": {
       "type": [
        "string",
        "null"
       ]
      }
     },
     "required": [
      "uid",
      "name",
      "role",
      "at",
      "reason"
     ],
     "additionalProperties": false
    },
    {
     "type": "null"
    }
   ]
  }
 },
 "required": [
  "version",
  "status",
  "reason",
  "created_at",
  "effective_from",
  "values",
  "proposed_by",
  "decided_by"
 ],
 "additionalProperties": false
}
