[
 {
  "version": 1,
  "status": "active",
  "reason": "Kanonik başlangıç limitleri (rules-v1.0 ön kaydı ile birlikte).",
  "created_at": "2026-11-08T09:00:00.000Z",
  "effective_from": "2026-11-09T06:00:00.000Z",
  "values": [
   {
    "key": "risk_per_trade_pct",
    "value": 0.005
   },
   {
    "key": "max_position_pct",
    "value": 0.1
   },
   {
    "key": "max_concurrent_positions",
    "value": 10
   },
   {
    "key": "target_concurrent_positions",
    "value": 8
   },
   {
    "key": "max_adv_share",
    "value": 0.01
   },
   {
    "key": "price_band_pct",
    "value": 0.02
   },
   {
    "key": "daily_loss_halt_pct",
    "value": -0.01
   },
   {
    "key": "kill_drawdown_pct",
    "value": -0.05
   },
   {
    "key": "min_edge_cost_ratio",
    "value": 2
   },
   {
    "key": "crisis_exposure_mult",
    "value": 0.5
   },
   {
    "key": "leak_ret5d_threshold",
    "value": 0.08
   },
   {
    "key": "max_sector_pct",
    "value": 0.25
   },
   {
    "key": "max_group_pct",
    "value": 0.2
   }
  ],
  "proposed_by": {
   "uid": "uye-1",
   "name": "Üye 1",
   "role": "admin",
   "at": "2026-11-08T09:00:00.000Z",
   "reason": "Kanonik başlangıç limitleri."
  },
  "decided_by": {
   "uid": "uye-3",
   "name": "Üye 3",
   "role": "risk_officer",
   "at": "2026-11-08T11:30:00.000Z",
   "reason": "Kanonik değerlerle aynı; onay."
  }
 }
]
